#,Name,Disclosure Date,Rank,Check,Description
"0","post/multi/manage/fileshare","","normal","No","Browse the session filesystem in a Web Browser"
"1","post/osx/escalate/tccbypass","","normal","Yes","Bypass the macOS TCC Framework"
"2","post/multi/escalate/cups_root_file_read","2012-11-20","normal","No","CUPS 1.6.1 Root File Read"
"3","post/multi/gather/chrome_cookies","","normal","No","Chrome Gather Cookies"
"4","post/multi/sap/smdagent_get_properties","","normal","No","Diagnostics Agent in Solution Manager, stores unencrypted credentials for Solution Manager server"
"5","post/multi/gather/dbeaver","","normal","No","Gather Dbeaver Passwords"
"6","post/multi/gather/grub_creds","","normal","No","Gather GRUB Password"
"7","post/multi/gather/minio_client","","normal","No","Gather MinIO Client Key"
"8","post/multi/gather/wowza_streaming_engine_creds","","normal","No","Gather Wowza Streaming Engine Credentials"
"9","post/multi/recon/multiport_egress_traffic","","normal","No","Generate TCP/UDP Outbound Traffic On Multiple Ports"
"10","post/osx/gather/gitignore","","normal","No","Git Ignore Retriever"
"11","post/multi/gather/lastpass_creds","","normal","No","LastPass Vault Decryptor"
"12","post/osx/gather/apfs_encrypted_volume_passwd","2018-03-21","normal","Yes","Mac OS X APFS Encrypted Volume Password Disclosure"
"13","post/multi/gather/dns_bruteforce","","normal","No","Multi Gather DNS Forward Lookup Bruteforce"
"14","post/multi/gather/dns_reverse_lookup","","normal","No","Multi Gather DNS Reverse Lookup Scan"
"15","post/multi/gather/dns_srv_lookup","","normal","No","Multi Gather DNS Service Record Lookup Scan"
"16","post/multi/gather/docker_creds","","normal","No","Multi Gather Docker Credentials Collection"
"17","post/multi/gather/filezilla_client_cred","","normal","No","Multi Gather FileZilla FTP Client Credential Collection"
"18","post/multi/gather/firefox_creds","","normal","No","Multi Gather Firefox Signon Credential Collection"
"19","post/multi/gather/gpg_creds","","normal","No","Multi Gather GnuPG Credentials Collection"
"20","post/multi/gather/irssi_creds","","normal","No","Multi Gather IRSSI IRC Password(s)"
"21","post/multi/gather/check_malware","","normal","No","Multi Gather Malware Verifier"
"22","post/multi/gather/maven_creds","","normal","No","Multi Gather Maven Credentials Collection"
"23","post/multi/gather/thunderbird_creds","","normal","No","Multi Gather Mozilla Thunderbird Signon Credential Collection"
"24","post/multi/gather/ssh_creds","","normal","No","Multi Gather OpenSSH PKI Credentials Collection"
"25","post/multi/gather/pidgin_cred","","normal","No","Multi Gather Pidgin Instant Messenger Credential Collection"
"26","post/multi/gather/ping_sweep","","normal","No","Multi Gather Ping Sweep"
"27","post/multi/gather/rubygems_api_key","","normal","No","Multi Gather RubyGems API Key"
"28","post/multi/gather/multi_command","","normal","No","Multi Gather Run Shell Command Resource File"
"29","post/multi/gather/skype_enum","","normal","No","Multi Gather Skype User Data Enumeration"
"30","post/multi/gather/ubiquiti_unifi_backup","","normal","No","Multi Gather Ubiquiti UniFi Controller Backup"
"31","post/multi/gather/find_vmx","","normal","No","Multi Gather VMWare VM Identification"
"32","post/multi/gather/enum_vbox","","normal","No","Multi Gather VirtualBox VM Enumeration"
"33","post/multi/gather/pgpass_creds","","normal","No","Multi Gather pgpass Credentials"
"34","post/multi/general/close","","normal","No","Multi Generic Operating System Session Close"
"35","post/multi/general/execute","","normal","No","Multi Generic Operating System Session Command Execution"
"36","post/multi/manage/multi_post","","normal","No","Multi Manage Post Module Macro Execution"
"37","post/multi/manage/record_mic","","normal","No","Multi Manage Record Microphone"
"38","post/multi/manage/set_wallpaper","","normal","No","Multi Manage Set Wallpaper"
"39","post/multi/manage/system_session","","normal","No","Multi Manage System Remote TCP Shell Session"
"40","post/multi/manage/play_youtube","","normal","No","Multi Manage YouTube Broadcast"
"41","post/multi/manage/screenshare","","normal","No","Multi Manage the screen of the target meterpreter session"
"42","post/multi/manage/screensaver","","normal","No","Multi Manage the screensaver of the target computer"
"43","post/multi/recon/local_exploit_suggester","","normal","No","Multi Recon Local Exploit Suggester"
"44","post/multi/gather/enum_software_versions","","normal","No","Multiplatform Installed Software Version Enumerator"
"45","post/multi/gather/wlan_geolocate","","normal","No","Multiplatform WLAN Enumeration and Geolocation"
"46","post/multi/manage/sudo","","normal","No","Multiple Linux / Unix Post Sudo Upgrade Shell"
"47","post/osx/gather/vnc_password_osx","","normal","No","OS X Display Apple VNC Password"
"48","post/osx/gather/enum_adium","","normal","No","OS X Gather Adium Enumeration"
"49","post/osx/gather/enum_airport","","normal","No","OS X Gather Airport Wireless Preferences"
"50","post/osx/gather/enum_chicken_vnc_profile","","normal","No","OS X Gather Chicken of the VNC Profile"
"51","post/osx/gather/enum_colloquy","","normal","No","OS X Gather Colloquy Enumeration"
"52","post/osx/gather/enum_keychain","","normal","No","OS X Gather Keychain Enumeration"
"53","post/osx/gather/hashdump","","normal","No","OS X Gather Mac OS X Password Hash Collector"
"54","post/osx/gather/enum_osx","","normal","No","OS X Gather Mac OS X System Information Enumeration"
"55","post/osx/gather/enum_messages","","normal","No","OS X Gather Messages"
"56","post/osx/manage/sonic_pi","","normal","No","OS X Manage Sonic Pi"
"57","post/osx/admin/say","","normal","No","OS X Text to Speech Utility"
"58","post/osx/capture/keylog_recorder","","normal","No","OSX Capture Userspace Keylogger"
"59","post/osx/gather/autologin_password","","normal","No","OSX Gather Autologin Password as Root"
"60","post/osx/gather/safari_lastsession","","normal","No","OSX Gather Safari LastSession.plist"
"61","post/osx/manage/record_mic","","normal","No","OSX Manage Record Microphone"
"62","post/osx/manage/webcam","","normal","No","OSX Manage Webcam"
"63","post/osx/manage/mount_share","","normal","No","OSX Network Share Mounter"
"64","post/osx/gather/password_prompt_spoof","","normal","No","OSX Password Prompt Spoof"
"65","post/osx/capture/screen","","normal","No","OSX Screen Capture"
"66","post/osx/manage/vpn","","normal","No","OSX VPN Manager"
"67","post/multi/manage/open","","normal","No","Open a file or URL on the target computer"
"68","post/multi/recon/reverse_lookup","","normal","No","Reverse Lookup IP Addresses"
"69","post/multi/manage/shell_to_meterpreter","","normal","No","Shell to Meterpreter Upgrade"
"70","post/multi/recon/sudo_commands","","normal","No","Sudo Commands"
"71","post/multi/gather/fetchmailrc_creds","","normal","No","UNIX Gather .fetchmailrc Credentials"
"72","post/multi/gather/netrc_creds","","normal","No","UNIX Gather .netrc Credentials"
"73","post/multi/gather/unix_cached_ad_hashes","","normal","No","UNIX Gather Cached AD Hashes"
"74","post/multi/gather/unix_kerberos_tickets","","normal","No","UNIX Gather Kerberos Tickets"
"75","post/multi/gather/remmina_creds","","normal","No","UNIX Gather Remmina Credentials"
"76","post/multi/manage/upload_exec","","normal","No","Upload and Execute"
"77","post/multi/manage/hsts_eraser","","normal","No","Web browsers HSTS entries eraser"
"78","post/multi/gather/apple_ios_backup","","normal","No","Windows Gather Apple iOS MobileSync Backup File Collection"
"79","post/multi/general/wall","","normal","No","Write Messages to Users"
