#,Name,Disclosure Date,Rank,Check,Description
"247","post/windows/manage/mssql_local_auth_bypass","","normal","No","Windows Manage Local Microsoft SQL Server Authorization Bypass"
"248","post/windows/manage/nbd_server","","normal","No","Windows Manage Local NBD Server for Remote Disks"
"249","post/windows/manage/delete_user","","normal","No","Windows Manage Local User Account Deletion"
"250","post/windows/manage/shellcode_inject","","normal","No","Windows Manage Memory Shellcode Injection Module"
"251","post/windows/manage/pxeexploit","","normal","No","Windows Manage PXE Exploit Server"
"252","post/windows/manage/persistence_exe","","normal","No","Windows Manage Persistent EXE Payload Installer"
"253","post/windows/manage/powershell/exec_powershell","","normal","No","Windows Manage PowerShell Download and/or Execute"
"254","post/windows/manage/priv_migrate","","normal","No","Windows Manage Privilege Based Process Migration"
"255","post/windows/manage/migrate","","normal","No","Windows Manage Process Migration"
"256","post/windows/manage/ie_proxypac","","normal","No","Windows Manage Proxy PAC File"
"257","post/windows/manage/clone_proxy_settings","","normal","No","Windows Manage Proxy Setting Cloner"
"258","post/windows/manage/rid_hijack","","normal","No","Windows Manage RID Hijacking"
"259","post/windows/manage/reflective_dll_inject","","normal","No","Windows Manage Reflective DLL Injection Module"
"260","post/windows/manage/rpcapd_start","","normal","No","Windows Manage Remote Packet Capture Service Starter"
"261","post/windows/manage/pptp_tunnel","","normal","No","Windows Manage Remote Point-to-Point Tunneling Protocol"
"262","post/windows/manage/run_as","","normal","No","Windows Manage Run Command As User"
"263","post/windows/manage/sdel","","normal","No","Windows Manage Safe Delete"
"264","post/windows/manage/portproxy","","normal","No","Windows Manage Set Port Forwarding With PortProxy"
"265","post/windows/manage/enable_support_account","","normal","No","Windows Manage Trojanize Support Account"
"266","post/windows/manage/vmdk_mount","","normal","No","Windows Manage VMDK Mount Drive"
"267","post/windows/manage/vss","","normal","No","Windows Manage Volume Shadow Copies"
"268","post/windows/manage/webcam","","normal","No","Windows Manage Webcam"
"269","post/windows/gather/netlm_downgrade","","normal","No","Windows NetLM Downgrade Attack"
"270","post/windows/recon/outbound_ports","","normal","No","Windows Outbound-Filtering Rules"
"271","post/windows/manage/killav","","normal","No","Windows Post Kill Antivirus and Hips"
"272","post/windows/manage/wdigest_caching","","normal","No","Windows Post Manage WDigest Credential Caching"
"273","post/windows/manage/exec_powershell","","normal","No","Windows Powershell Execution Post Module"
"274","post/windows/gather/memory_dump","","normal","No","Windows Process Memory Dump"
"275","post/windows/gather/credentials/pulse_secure","","normal","Yes","Windows Pulse Secure Connect Client Saved Password Extractor"
"276","post/windows/recon/computer_browser_discovery","","normal","No","Windows Recon Computer Browser Discovery"
"277","post/windows/gather/credentials/windows_sam_hivenightmare","2021-07-20","normal","No","Windows SAM secrets leak - HiveNightmare"
"278","post/windows/gather/credentials/securecrt","","normal","No","Windows SecureCRT Session Information Enumeration"
"279","post/windows/wlan/wlan_probe_request","","normal","No","Windows Send Probe Request Packets"
"280","post/windows/gather/credentials/sso","","normal","No","Windows Single Sign On Credential Collector (Mimikatz)"
"281","post/windows/escalate/unmarshal_cmd_exec","2018-08-05","normal","No","Windows unmarshal post exploitation"
"282","post/windows/gather/credentials/xchat","","normal","No","Xchat credential gatherer"
